{"observed_at_utc":"2026-10-11T12:38:06Z","operational":{"B":"2392518188130438742016","first_incomplete_end":"2392518189229950369792","first_incomplete_unit":"2175982616","first_unassigned_unit":"2175982616","headline_B":"2392312122059207475200","site_generated_utc":"2026-10-11T11:29:26Z","source_url":"https://pcbarina.fit.vut.cz/","tier":"author_reported_not_replicated","work_unit_size":"1099511627776"},"published":{"B":"2361183241434822606848","publication_date":"2025-05-02","source_url":"https://doi.org/10.1007/s11227-025-07337-0","tier":"peer_reviewed_published"},"research_only":"yes","schema":"CEML-FRONTIER-1-SNAPSHOT"}